{
    "shipvitals_evidence":  1,
    "kind":  "runtime",
    "observed_at":  "2026-06-22T12:00:00Z",
    "source":  "shipvitals-self-audit",
    "summary":  "The documented CLI, package, benchmark, and site validation commands completed locally.",
    "artifacts":  [
                      {
                          "path":  "runtime-proof.md",
                          "sha256":  "289b1b3f04e1ddbd93234c1fcb395e1c140b0ad51eac159053a434a8fc0f453b"
                      }
                  ]
}
