{
    "shipvitals_evidence":  1,
    "kind":  "visual",
    "observed_at":  "2026-06-22T12:00:00Z",
    "source":  "playwright-mobile-check",
    "summary":  "The public project site was rendered and inspected at a mobile viewport.",
    "artifacts":  [
                      {
                          "path":  "visual/mobile.png",
                          "sha256":  "f2f25f592bbaf5963ffaff995f5c1a228584e01c2365ed7ad2e21932481c4083"
                      }
                  ]
}
